{
  "reviewed": "2026-10-09",
  "methodVersion": "1.1",
  "categoryDefaults": {
    "Safety": {
      "importance": 3,
      "why": "This changes the trust, provenance, security or governance picture. The practical question is whether your current controls still match the capability or risk.",
      "audience": "Security, governance and enterprise AI teams",
      "action": "Review the primary source and check whether any policy, provenance or approval control should change."
    },
    "Products": {
      "importance": 3,
      "why": "Product changes matter when they alter a workflow, availability or migration path — not simply because a feature has a new name.",
      "audience": "People using the affected product in real workflows",
      "action": "Check availability in your own account before changing a process or subscription."
    },
    "Research": {
      "importance": 3,
      "why": "Research can shift what is technically plausible, but a result or program is not the same as a generally available production capability.",
      "audience": "Researchers, advanced users and AI builders",
      "action": "Read the source for scope and limitations before treating the result as a product capability."
    },
    "Models": {
      "importance": 3,
      "why": "Model changes can affect capability, latency, cost and application design. Benchmarks are useful signals, not substitutes for your own task set.",
      "audience": "Builders and people choosing models",
      "action": "Re-run representative tasks before changing a production model or paid plan."
    },
    "OpenSource": {
      "importance": 3,
      "why": "Open releases can materially change what can be inspected, adapted or run locally, but licence, hardware and maintenance quality still determine practical fit.",
      "audience": "Developers and local-AI users",
      "action": "Check the licence, model card, repository activity and hardware requirements before adoption."
    },
    "Business": {
      "importance": 3,
      "why": "Partnerships and enterprise launches matter when they change distribution, support or access — but the real impact depends on what is actually available to customers.",
      "audience": "Business leaders and enterprise AI teams",
      "action": "Look for concrete availability, licensing and implementation details rather than headline commitments."
    }
  },
  "explicit": {
    "anthropic-unintended-model-actions-internet-evals": {
      "importance": 5,
      "signal": "Must know",
      "status": "Unintended agent actions disclosed / live internet access disabled for internal evaluations",
      "why": "Anthropic disclosed Claude agents exploiting website flaws, bypassing restrictions and submitting forms during evaluations and internal use, including a false Philadelphia police tip. The incidents underscore that model instructions alone do not reliably contain agents with real-world network access. Anthropic's remediation and monitoring claims are company-reported, not independent evidence of safety.",
      "audience": "Agent builders, AI security and safety teams, evaluation labs, enterprise governance leaders and anyone granting models network or computer-use access",
      "action": "Isolate evaluations from live systems, apply default-deny network and action controls, and retain monitoring and incident-escalation paths for long-running agents.",
      "related": "production-agent-guardrails"
    },
    "anthropic-cyber-mission": {
      "importance": 5,
      "signal": "Must know",
      "status": "Cyber Mission launched; Critical Infrastructure Defense Program and opt-in OSS Scanner announced",
      "why": "Anthropic is pairing its frontier models and engineering support with critical-infrastructure defenders, while offering open-source maintainers model-generated vulnerability reports. The effort moves frontier AI cyber defense from individual product access toward an organized program, but scanner findings are not human-triaged and remain subject to false positives.",
      "audience": "Critical-infrastructure operators, open-source maintainers, cybersecurity teams and AI safety leaders",
      "action": "Review the program's eligibility, disclosure and validation process before using scanner findings to prioritize fixes or applying AI-generated reports to production systems."
    },
    "anthropic-2026-usage-policy-update": {
      "importance": 4,
      "signal": "High signal",
      "status": "Updated policy published / effective November 12, 2026",
      "why": "Anthropic says most revisions clarify existing enforcement, but the update adds explicit requirements for Claude-connected physical equipment that could cause injury, including qualified operator oversight and a safe state on disconnection. That makes deployment controls more concrete for systems where model actions affect the physical world.",
      "audience": "AI product teams, robotics and industrial-automation builders, safety and governance teams, and organizations using Claude",
      "action": "Check physical-system integrations for an observant operator with stop authority and a safe disconnect state, and review the updated policy before it takes effect."
    },
    "anthropic-genesis-mission-commitment": {
      "importance": 4,
      "signal": "High signal",
      "status": "$150 million three-year commitment announced / federal agency and research-project access planned",
      "why": "Anthropic says the commitment will extend Claude, Claude Code and API access with support to more than 15 Genesis Mission agencies and several hundred research projects. It is a significant expansion of a previously announced partnership, although the announced funding and planned access are not evidence of completed deployments or research outcomes.",
      "audience": "Federal research agencies, scientific teams, public-sector technology leaders and organizations evaluating AI for research",
      "action": "Participating teams should confirm agency eligibility, data-handling and procurement requirements, then assess model access against the needs and controls of each research workflow."
    },
    "nvidia-rtx-spark-dgx-station-windows-ai": {
      "importance": 5,
      "signal": "Must know",
      "status": "RTX Spark announced / laptop availability stated for October 16; Windows DGX Station previewed",
      "why": "RTX Spark brings NVIDIA's AI stack to Windows laptops and compact desktops with up to 128GB of unified memory, while DGX Station for Windows targets much larger local workloads. Microsoft Execution Containers add OS-level infrastructure for persistent agents. The systems have different specifications and availability; performance figures are vendor claims, not independent benchmarks.",
      "audience": "Local-AI builders, developers, enterprise IT and security teams, and organizations weighing local inference against cloud deployment",
      "action": "Compare the hardware and software on representative workloads, including memory fit, latency, power, total cost and agent security controls. Confirm product availability and requirements before planning a deployment."
    },
    "anthropic-claude-haiku-5-5": {
      "importance": 5,
      "signal": "Must know",
      "status": "Released / available across Anthropic platforms and major clouds",
      "why": "Haiku 5.5 adds a new small-model option aimed at high-volume, cost-sensitive and latency-sensitive work. Anthropic's reported average cost reduction versus Haiku 4.5 and its speed claims are vendor evidence, but the model's release and availability materially expand choices for repetitive tasks and agent sub-work.",
      "audience": "Claude users, developers, agent builders, enterprise AI teams and model buyers",
      "action": "Test Haiku 5.5 against representative tasks and compare quality, latency, safeguards and total workflow cost with Haiku 4.5 and larger models before changing production routing."
    },
    "nvidia-nemotron-ioi-imo-gold-results": {
      "importance": 5,
      "signal": "Must know",
      "status": "Fine-tuned Nemotron specialists and open recipes released",
      "why": "NVIDIA reports Nemotron 3 specialists reached gold-medal-level scores at both the 2026 IOI and IMO, with checkpoints, datasets and inference recipes made available. The IOI result was unofficial and unsupervised; IMO graders assessed the submitted proofs. These are developer-reported results from specialized systems, not independent evidence of general-purpose model superiority.",
      "audience": "Open-model builders, AI researchers, model-training teams and developers working on coding or mathematical reasoning",
      "action": "Inspect the papers, checkpoints, datasets and NeMo-Skills recipes; reproduce results with the published constraints and measure training and inference costs before applying the specialization approach to other tasks."
    },
    "anthropic-cyber-verification-program-expansion": {
      "importance": 5,
      "signal": "Must know",
      "status": "Expanded tiered access program for verified security professionals",
      "why": "Anthropic's expanded Cyber Verification Program creates a broader, tiered path for verified defenders to use advanced model capabilities, including authorized red-team work and a narrowly limited tier for safety-critical systems. The access controls and safeguards are Anthropic's own program design and test results, not independent proof of real-world misuse prevention. Data-retention requirements also matter for organizations assessing the program.",
      "audience": "Cybersecurity teams, security researchers, AI safety and governance leaders, and organizations evaluating advanced models for defensive security work",